{
  "slug": "durable",
  "family": "comparar",
  "author": "claude-code-session",
  "prompt_version": "comparar-v1",
  "facts_hash": "sha256:823f6149b282e4fe6592daa1ab904a474aa956f37dd26f985adb5607aec9773d",
  "blocks": {
    "summary": [
      {
        "text": "Durable combina sitio, CRM y cobros: su plan gratis incluye un CRM de hasta 10 clientes y el plan Launch cuesta 25 USD al mes.",
        "facts": [
          "durable.free.crm10",
          "durable.price.launch"
        ]
      },
      {
        "text": "Beegen separa las piezas: el CRM es gratis con 1 usuario y el Sitio web cuesta $149 MXN al mes por sitio.",
        "facts": [
          "modules.crm.includedQuota.quantity",
          "modules.site.priceMxn"
        ]
      },
      {
        "text": "Comparamos el costo, el CRM, la IA incluida y qué pasa con tu dominio.",
        "facts": [
          "durable.launch.features",
          "durable.domain.minimum"
        ]
      }
    ],
    "beegen_fits": [
      {
        "text": "Si quieres un CRM sin tope de 10 clientes: el de Beegen tiene contactos, pipeline y tareas, gratis con 1 usuario.",
        "facts": [
          "modules.crm.tagline",
          "modules.crm.includedQuota.quantity",
          "durable.free.crm10"
        ]
      },
      {
        "text": "Si tus clientes escriben por WhatsApp: el agente de Beegen cuesta $299 MXN al mes por número y responde 24/7.",
        "facts": [
          "modules.wa_agent.priceMxn",
          "modules.wa_agent.tagline"
        ]
      },
      {
        "text": "Si quieres que el dominio sea tuyo desde el principio: el sitio de Beegen incluye dominio propio y formularios al CRM.",
        "facts": [
          "modules.site.description"
        ]
      },
      {
        "text": "Si vas a cobrar a clientes en México: Cobros llega próximamente, sin mensualidad y con 2% por cobro.",
        "facts": [
          "modules.payments.priceMxn"
        ]
      }
    ],
    "faq": [
      {
        "q": "¿Cuánto cuesta Durable?",
        "a": [
          {
            "text": "Durable tiene un plan gratis; el Launch cuesta 25 USD al mes o 22 USD con pago anual, y el Grow 49 USD al mes o 41 USD con pago anual.",
            "facts": [
              "durable.free.crm10",
              "durable.price.launch",
              "durable.price.grow"
            ]
          }
        ]
      },
      {
        "q": "¿Qué incluye el plan gratis de Durable?",
        "a": [
          {
            "text": "Un subdominio durable.site y un CRM de hasta 10 clientes.",
            "facts": [
              "durable.free.crm10"
            ]
          }
        ]
      },
      {
        "q": "¿Cuánta IA incluye el plan Launch de Durable?",
        "a": [
          {
            "text": "El plan Launch incluye 1,000 créditos de IA al mes.",
            "facts": [
              "durable.launch.features"
            ]
          }
        ]
      },
      {
        "q": "¿Puedo llevarme mi dominio de Durable?",
        "a": [
          {
            "text": "Según sus preguntas frecuentes, sacar un dominio toma un par de semanas y tiene un tiempo mínimo de suscripción.",
            "facts": [
              "durable.domain.minimum"
            ]
          }
        ]
      },
      {
        "q": "¿Qué incluye el sitio de Beegen?",
        "a": [
          {
            "text": "Por $149 MXN al mes por sitio: dominio propio, formularios al CRM y hasta 100 ediciones con IA al mes.",
            "facts": [
              "modules.site.priceMxn",
              "modules.site.description"
            ]
          }
        ]
      }
    ]
  }
}
